Name,Username X,First-line cá nhân hóa,Score fit,Hook
Must Profit FX | Market Research,@PalashD66393859,Your gold analysis reads like someone who has spent years watching SMC structure — the order blocks and FVG zones you highlight show a methodical approach to London and NY sessions.,8,"For SMC-focused gold traders, the real edge is often in cleaner zone selection before price ever triggers the entry."
WikiGold.MY,@WikiGold_MY,"Your approach to gold pricing, explaining the DXY correlation clearly for Malaysian traders, shows you understand the macro forces behind XAUUSD moves.",7,Gold traders who watch the dollar-gold relationship closely usually value cleaner planning frameworks around key data releases.
$N30 . Neo Malesa,@n30dyn4m1c,"You seem to track gold through session-based price action, noting kijun rebalancing levels and recognizing when London and New York opens are the only windows worth watching.",7,"For traders who focus on session timing and clean price levels, the useful edge is often in knowing which opens to ignore before the entry setup forms."
Calas,@tt3y__3,You style yourself as an ICT trader and your XAUUSD London session post with a defined 2RR shows a focus on structured risk-to-reward execution.,7,ICT traders who track XAUUSD London setups tend to benefit from cleaner session timing and clearer liquidity zones.
Pips Protege📈,@pipsprotege,"Your focus on securing payouts through consistent XAUUSD execution, combined with the funded trader identity, suggests a disciplined prop-trading mindset.",8,Prop traders who grind gold with payout targets in mind typically value stronger risk frameworks around session-specific entries.
Elliottwave Forecast,@ElliottForecast,"Your Elliott Wave community covers 78 markets, and the gold analysis calling for a 3 or 7 swing failure against 4384 shows a structured wave-counting approach to XAUUSD.",8,Elliott Wave traders tracking gold swings usually benefit from cleaner level alignment between wave counts and session-based liquidity zones.
Forex Analytix,@forexanalytix,Your UK/EU session updates on XAUUSD consistently provide clean support and resistance levels with macro context — the 4100 test call and 3880/3900 downside scenario show methodical analysis.,8,"For session-based gold analysts, the real value is often in cleaner zone identification before price reaches the level."
Mohammad Sami,@wholepips,"Your XAUUSD trade updates with specific entry levels and TP hits show a structured approach to gold signals, and the 490-pip move you shared demonstrates follow-through on your analysis.",7,Gold signal providers who share clear entries and TP structure usually want cleaner session timing to improve their call accuracy.
Viktors Silovs,@silovs,"Your pre-London gold outlook with defined resistance at 4050-4055 and support at 4000, plus the conditional plan for short or long, shows a structured, rule-based trading approach.",7,Traders who plan both scenarios before London opens usually get more value from cleaner session timing and zone discipline.
Trading Signals Fx ®,@TSFX_forex,"Your market coverage connects macro news to XAUUSD context, from Hormuz shipping risks to UK industrial orders, showing you trade gold through a wider economic lens.",7,News-aware gold traders tend to get better results when they pair event-driven context with cleaner technical execution zones.
Quantum360,@thesonicshift,"Your QFG gold mapping with bi-directional levels, the 770-pip measured range, and the exact 4037 hit at R1 target shows a precision-oriented approach to XAUUSD structure.",7,Traders who map both directions before price moves usually value frameworks that filter noise around key structural levels.
BIG MAN DAN,@BIGMANTRADEZ,Your XAUUSD session commentary — calling the sluggish London and watching for a new bias in NY — shows you track gold intraday and read session shifts as they develop.,7,Traders who feel session momentum shifts in gold usually get better results when cleaner entry zones are defined before London picks up.
AwknWolf 👁️ 🐺,@mrwolfein,Your gold analysis calling for upside liquidity grabs from London and Asia before targeting lower levels shows you think in liquidity-driven market structure.,7,Traders who map liquidity grabs before entries typically benefit from cleaner identification of which session's liquidity will sweep first.
Vera,@vera_xauusd,Your gold breakdown noting the $4480 support and the bearish scenario to $4450 or $4400 shows a clear level-based approach to XAUUSD with downside planning.,7,Gold analysts who map clear support breaks and extension targets usually want firmer entry timing around those levels.
Lika,@Lika_XAUUSD,Your gold analysis focusing on the 4530-4540 short-term resistance zone with a 4-hour chart perspective shows you blend technical structure with session timing in your signal approach.,7,Traders who track gold through defined resistance zones on higher timeframes typically benefit from tighter precision around the entry triggers.
Itsadiee_Fx,@Itsadiee1,"Your XAUUSD trade breakdown shows you combine institutional concepts with psychological trading, which gives your analysis a practical edge beyond just calling levels.",7,Signal providers who explain the logic behind 190-pip gold moves typically resonate with traders wanting to understand the 'why' behind entries.
AriDonXAU,@AriDonFX1,Your XAUUSD London session trading with a Telegram community and affiliate partnership with BlueGuardian shows you've built a structured setup around gold trading education and signals.,8,Traders running gold communities typically benefit most from session-timing tools that help their members catch cleaner entries.
1TRADE,@1trade0,Your XAUUSD analysis using Turtle Soup confirmation and IFVG retracement concepts shows a strong grasp of ICT structure applied to gold with clear directional conviction.,8,ICT traders who map HTF liquidity sweeps on gold usually get the most value from session-specific timing around their FVG and order block zones.
𝔲𝔦𝔭𝔭𝔯,@uipprfx,"Your MMSM XAUUSD setups using London High taken, iFVG displacement, and SMT with XAG show a structured SMC approach to gold that tracks intermarket relationships.",7,Traders who track SMT between gold and silver usually get better confirmation when they combine it with session-level displacement timing.
XAUUSD (Gold) - Traders,@TradersXauusd,Your gold technical analysis identifying the $250 decline from 4760+ and the accelerated decline phase within a downward channel shows a solid grasp of gold's structural bearish trend.,7,Gold analysts tracking channel structure usually get clearer entries when they align their levels with session-specific liquidity zones.
kia,@trade_with_kia,"Your SMC gold analysis on the 2-hour timeframe, tracking the bearish pressure from 4,700 supply zone through equilibrium breakdown, shows a structured educational approach to gold trading.",8,Traders who combine SMC with price action on gold usually benefit most from cleaner session-level supply and demand identification.
HARRY,@forextrader_19,"Your UK market open analysis linking economic data to gold impact, with XAUUSD trading at 3974, shows you track gold through a macro-event lens around session opens.",7,Traders who analyze gold through UK market open data releases usually get cleaner entries when they pair macro context with zone-based execution timing.
Divyesh Lapalikar | Gold & Dollar Analyst,@Fci_Futures,"Your daily gold breakdowns explain the mechanics behind every move without hype or signals — the 3% Wednesday decline, PCE/GDP context, and the 4030 resistance test show you focus on education over promotion.",9,"Gold analysts who explain the mechanics behind every move — not signals, not hype — usually resonate most with traders looking to understand the market rather than just follow calls."
Rector,@EnwongoOkokon,"Your approach to helping traders master XAUUSD with discipline and psychology — no signals, just structure — sets you apart from the typical gold signal accounts.",7,Educators who teach XAUUSD through trading psychology and structure — without signals — typically want frameworks that help students understand the 'why' behind session-based execution.
Jane | Market Analyst & Signals,@XAUUSD_Jane,"Your daily gold outlooks covering what to expect in London and NY sessions, with bearish bias and oversold rebound awareness, show a consistent session-aware analytical approach.",7,Signal providers who structure their gold calls around session timing typically get cleaner entries when they define the exact zone before the session opens.
Alish Prajapati,@Cashvolumes,"Your volume-based approach to XAUUSD, calling the pre-London scalp from 4081 with a defined range target, shows you trade gold with precision and measured risk in mind.",8,Volume-aware gold traders who track pre-session levels often get the clearest edge from knowing exactly which zone will trigger the move.
Kceejones,@kceejones_,"Your ICT-style XAUUSD daily trading plan with a defined sell zone at 4,150–4,220 and bearish bias shows a structured approach to gold using propulsion block premium concepts.",7,ICT traders who map daily sell zones with propulsion block levels often get the most from aligning their entry timing with session-specific liquidity sweeps.
liquidity injection,@Sir_Liquidity,Your focus on liquidity as a trading concept and your community engagement around gold's London session direction show you think in market structure terms.,7,Traders who build their identity around liquidity concepts usually get better results when they combine directional conviction with precise session entry zones.
Lrene,@lrene_CFA,Your gold analysis hitting target price 4 at 4543 with 270 points of profit shows a methodical target-based approach to XAUUSD with clear exit strategy.,7,Analysts who define multiple target levels on gold typically benefit from tighter entry precision that protects their projected risk-reward ratios.
Derick,@losttrader6,"Your trader identity centered on XAUUSD with documented lessons, risk management, and a longevity mindset shows you're building something real around gold trading education.",7,Traders who document wins and losses openly on XAUUSD usually respond well to frameworks that help them shorten the learning curve without sacrificing risk discipline.
XAUUSD SIGNALS,@FX_GoldSniper,Your gold signal analysis with defined resistance zones at 4560 and 4680 and the conditional plan for holding above 4480-4560 shows a structured level-based approach to XAUUSD.,7,Signal providers who pair resistance levels with session-conditional plans give their followers more actionable context than generic buy-sell calls.
Om Aditya,@adityaomyt,Your XAUUSD analysis calling position stacking gambling unless you know levels and structure — then showing a 1000+ pip move from that exact point — demonstrates a clear structural edge.,7,"Traders who understand that position stacking works with structure, not against it, typically value frameworks that help define the exact levels before adding size."
Cho | XAUUSD Trader,@SersanOding,"Your XAUUSD scalping consistency on London and NY sessions with strong risk management, plus the prop firm challenge context, shows a disciplined approach to funded account goals.",7,Prop-focused gold scalpers typically gain the most from session-specific entry precision that protects drawdown limits during evaluation.
